{
  "schemaVersion": 1,
  "id": "mock-cpu-c-full-jit",
  "provenance": "mock",
  "createdAt": "2000-01-01T08:30:00.000Z",
  "endedAt": "2000-01-01T08:30:00.351Z",
  "status": "succeeded",
  "durationMs": 351.6,
  "entry": {
    "path": "mock://cpu_jit_demo.py",
    "function": "__main__",
    "kwargs": {},
    "source": "# MOCK DEMO — illustrative script, not a captured execution.\nimport tilelang\nimport tilelang.cpu.language as T\n\n\n@tilelang.jit(target=\"c\", execution_backend=\"cython\", out_idx=[2])\ndef vector_add(size=128):\n    @T.prim_func\n    def main(A: T.Tensor((size,), \"float32\"),\n             B: T.Tensor((size,), \"float32\"),\n             C: T.Tensor((size,), \"float32\")):\n        with T.Kernel(1):\n            for i in T.serial(size):\n                C[i] = A[i] + B[i]\n    return main\n\n\n@tilelang.jit(target=\"c\", execution_backend=\"cython\", out_idx=[1])\ndef scale(size=128):\n    @T.prim_func\n    def main(A: T.Tensor((size,), \"float32\"),\n             C: T.Tensor((size,), \"float32\")):\n        with T.Kernel(1):\n            for i in T.serial(size):\n                C[i] = A[i] * 2.0\n    return main\n\n\nif __name__ == \"__main__\":\n    add_kernel = vector_add(128)       # Compile and load native module.\n    cached_kernel = vector_add(128)    # Reuse this decorator's local cache.\n    scale_kernel = scale(128)          # Compile another kernel.\n    print(\"CPU JIT requests completed\")\n",
    "mode": "script",
    "args": [],
    "cwd": "/mock/workspace"
  },
  "environment": {
    "python": "Python 3.x (mock)",
    "tilelangVersion": "0.1.15 (mock)",
    "tilelangPath": "mock://tilelang",
    "target": {
      "kind": "c"
    },
    "executionBackend": "cython",
    "compilationMode": "jit"
  },
  "kernels": [
    {
      "id": "mock-kernel-1",
      "name": "vector_add",
      "symbol": "vector_add",
      "status": "succeeded",
      "cache": "miss",
      "cacheSource": "unknown",
      "stages": [
        {
          "id": "mock-stage-01",
          "sequence": 1,
          "kind": "source",
          "name": "Python source",
          "phase": null,
          "parentId": null,
          "depth": 0,
          "status": "succeeded",
          "beforeText": null,
          "afterText": "# MOCK DEMO — illustrative script, not a captured execution.\nimport tilelang\nimport tilelang.cpu.language as T\n\n\n@tilelang.jit(target=\"c\", execution_backend=\"cython\", out_idx=[2])\ndef vector_add(size=128):\n    @T.prim_func\n    def main(A: T.Tensor((size,), \"float32\"),\n             B: T.Tensor((size,), \"float32\"),\n             C: T.Tensor((size,), \"float32\")):\n        with T.Kernel(1):\n            for i in T.serial(size):\n                C[i] = A[i] + B[i]\n    return main\n\n\n@tilelang.jit(target=\"c\", execution_backend=\"cython\", out_idx=[1])\ndef scale(size=128):\n    @T.prim_func\n    def main(A: T.Tensor((size,), \"float32\"),\n             C: T.Tensor((size,), \"float32\")):\n        with T.Kernel(1):\n            for i in T.serial(size):\n                C[i] = A[i] * 2.0\n    return main\n\n\nif __name__ == \"__main__\":\n    add_kernel = vector_add(128)       # Compile and load native module.\n    cached_kernel = vector_add(128)    # Reuse this decorator's local cache.\n    scale_kernel = scale(128)          # Compile another kernel.\n    print(\"CPU JIT requests completed\")\n",
          "beforeLanguage": "python",
          "afterLanguage": "python",
          "durationMs": null,
          "changed": null,
          "added": null,
          "deleted": null
        },
        {
          "id": "mock-stage-02",
          "sequence": 2,
          "kind": "frontend",
          "name": "Frontend · PrimFunc",
          "phase": null,
          "parentId": null,
          "depth": 0,
          "status": "succeeded",
          "beforeText": null,
          "afterText": "@T.prim_func\ndef vector_add(A: T.Buffer((128,), \"float32\"),\n               B: T.Buffer((128,), \"float32\"),\n               C: T.Buffer((128,), \"float32\")):\n    T.func_attr({\"global_symbol\": \"vector_add\", \"tir.noalias\": True})\n    for block in T.serial(1):\n        for i in T.serial(64 * 2):\n            C[i] = A[i] + B[i]\n",
          "beforeLanguage": "python",
          "afterLanguage": "python",
          "durationMs": 2.4,
          "changed": null,
          "added": null,
          "deleted": null
        },
        {
          "id": "mock-stage-03",
          "sequence": 3,
          "kind": "pass",
          "name": "BindTarget",
          "phase": "Lowering",
          "parentId": null,
          "depth": 0,
          "status": "succeeded",
          "beforeText": "@T.prim_func\ndef vector_add(A: T.Buffer((128,), \"float32\"),\n               B: T.Buffer((128,), \"float32\"),\n               C: T.Buffer((128,), \"float32\")):\n    T.func_attr({\"global_symbol\": \"vector_add\", \"tir.noalias\": True})\n    for block in T.serial(1):\n        for i in T.serial(64 * 2):\n            C[i] = A[i] + B[i]\n",
          "afterText": "@T.prim_func\ndef vector_add(A: T.Buffer((128,), \"float32\"),\n               B: T.Buffer((128,), \"float32\"),\n               C: T.Buffer((128,), \"float32\")):\n    T.func_attr({\"global_symbol\": \"vector_add\", \"tir.noalias\": True, \"target\": \"c\"})\n    for block in T.serial(1):\n        for i in T.serial(64 * 2):\n            C[i] = A[i] + B[i]\n",
          "beforeLanguage": "python",
          "afterLanguage": "python",
          "durationMs": 0.16,
          "changed": true,
          "added": 1,
          "deleted": 1
        },
        {
          "id": "mock-stage-04",
          "sequence": 4,
          "kind": "pass",
          "name": "LoweringPipeline",
          "phase": "Lowering",
          "parentId": null,
          "depth": 0,
          "status": "succeeded",
          "beforeText": "@T.prim_func\ndef vector_add(A: T.Buffer((128,), \"float32\"),\n               B: T.Buffer((128,), \"float32\"),\n               C: T.Buffer((128,), \"float32\")):\n    T.func_attr({\"global_symbol\": \"vector_add\", \"tir.noalias\": True, \"target\": \"c\"})\n    for block in T.serial(1):\n        for i in T.serial(64 * 2):\n            C[i] = A[i] + B[i]\n",
          "afterText": "@T.prim_func\ndef vector_add(A: T.Buffer((128,), \"float32\"),\n               B: T.Buffer((128,), \"float32\"),\n               C: T.Buffer((128,), \"float32\")):\n    T.func_attr({\"global_symbol\": \"vector_add\", \"tir.noalias\": True, \"target\": \"c\"})\n    for i in T.serial(128):\n        C[i] = A[i] + B[i]\n",
          "beforeLanguage": "python",
          "afterLanguage": "python",
          "durationMs": 9.7,
          "changed": true,
          "added": 2,
          "deleted": 3
        },
        {
          "id": "mock-stage-05",
          "sequence": 5,
          "kind": "pass",
          "name": "Simplify",
          "phase": "Lowering",
          "parentId": "mock-stage-04",
          "depth": 1,
          "status": "succeeded",
          "beforeText": "@T.prim_func\ndef vector_add(A: T.Buffer((128,), \"float32\"),\n               B: T.Buffer((128,), \"float32\"),\n               C: T.Buffer((128,), \"float32\")):\n    T.func_attr({\"global_symbol\": \"vector_add\", \"tir.noalias\": True, \"target\": \"c\"})\n    for block in T.serial(1):\n        for i in T.serial(64 * 2):\n            C[i] = A[i] + B[i]\n",
          "afterText": "@T.prim_func\ndef vector_add(A: T.Buffer((128,), \"float32\"),\n               B: T.Buffer((128,), \"float32\"),\n               C: T.Buffer((128,), \"float32\")):\n    T.func_attr({\"global_symbol\": \"vector_add\", \"tir.noalias\": True, \"target\": \"c\"})\n    for block in T.serial(1):\n        for i in T.serial(128):\n            C[i] = A[i] + B[i]\n",
          "beforeLanguage": "python",
          "afterLanguage": "python",
          "durationMs": 1.35,
          "changed": true,
          "added": 1,
          "deleted": 1
        },
        {
          "id": "mock-stage-06",
          "sequence": 6,
          "kind": "pass",
          "name": "LowerTileOp",
          "phase": "Lowering",
          "parentId": "mock-stage-04",
          "depth": 1,
          "status": "succeeded",
          "beforeText": "@T.prim_func\ndef vector_add(A: T.Buffer((128,), \"float32\"),\n               B: T.Buffer((128,), \"float32\"),\n               C: T.Buffer((128,), \"float32\")):\n    T.func_attr({\"global_symbol\": \"vector_add\", \"tir.noalias\": True, \"target\": \"c\"})\n    for block in T.serial(1):\n        for i in T.serial(128):\n            C[i] = A[i] + B[i]\n",
          "afterText": "@T.prim_func\ndef vector_add(A: T.Buffer((128,), \"float32\"),\n               B: T.Buffer((128,), \"float32\"),\n               C: T.Buffer((128,), \"float32\")):\n    T.func_attr({\"global_symbol\": \"vector_add\", \"tir.noalias\": True, \"target\": \"c\"})\n    for i in T.serial(128):\n        C[i] = A[i] + B[i]\n",
          "beforeLanguage": "python",
          "afterLanguage": "python",
          "durationMs": 5.07,
          "changed": true,
          "added": 2,
          "deleted": 3
        },
        {
          "id": "mock-stage-07",
          "sequence": 7,
          "kind": "pass",
          "name": "Simplify",
          "phase": "Lowering",
          "parentId": null,
          "depth": 0,
          "status": "succeeded",
          "beforeText": "@T.prim_func\ndef vector_add(A: T.Buffer((128,), \"float32\"),\n               B: T.Buffer((128,), \"float32\"),\n               C: T.Buffer((128,), \"float32\")):\n    T.func_attr({\"global_symbol\": \"vector_add\", \"tir.noalias\": True, \"target\": \"c\"})\n    for i in T.serial(128):\n        C[i] = A[i] + B[i]\n",